{
  "schema_version": "2.0.0",
  "assessment_model_id": "TVA-001",
  "algorithm_version": "1.0.0",
  "testcase_model_reference": {
    "model_id": "TC-MODEL-COMPUTED",
    "path": "tests/fixtures/value-assessment/computed/testcase-model.json",
    "content_hash": "sha256:d3028b1b6cb3294c0e6311e1856f7a4b6b933e4a07a4fb21b8e3f902cbc55bd5"
  },
  "risk_matrix_reference": {
    "matrix_id": "MATRIX-001",
    "path": "tests/fixtures/value-assessment/computed/risk-coverage-matrix.json",
    "content_hash": "sha256:0ad8096fcbebac6fb0251cf286fbe487e01e12f02b81e9317695b2e47022bbfe"
  },
  "requirement_model_reference": {
    "analysis_id": "AN-REQ-001",
    "path": "tests/fixtures/value-assessment/computed/requirement-analysis.json",
    "content_hash": "sha256:5f7f8b214ad67fc96c6b2d8aa48244c93d6a74d009a9e0aa70233d49f5815a68"
  },
  "maintenance_inputs": {
    "TC001": {
      "external_system_dependency_count": 0,
      "mutable_shared_data_dependency_count": 0,
      "manual_oracle_count": 0,
      "environment_specific_dependency_count": 0
    },
    "TC002": {
      "external_system_dependency_count": 0,
      "mutable_shared_data_dependency_count": 0,
      "manual_oracle_count": 0,
      "environment_specific_dependency_count": 0
    }
  },
  "assessments": [
    {
      "tc_id": "TC001",
      "score_status": "computed",
      "dimensions": {
        "business_impact": 4,
        "risk_coverage_value": 5,
        "regression_value": 5,
        "diagnostic_value": 5,
        "evidence_confidence": 5,
        "maintenance_cost": 1,
        "redundancy_penalty": 0
      },
      "total_score": 98,
      "value_band": "high_value_core",
      "guardrails": [
        "p0_mapped"
      ],
      "reason_codes": [
        "CRITICAL_BUSINESS_IMPACT",
        "P0_RISK_COVERAGE",
        "CORE_REGRESSION"
      ],
      "recommendation": "retain_guarded"
    },
    {
      "tc_id": "TC002",
      "score_status": "computed",
      "dimensions": {
        "business_impact": 4,
        "risk_coverage_value": 4,
        "regression_value": 3,
        "diagnostic_value": 5,
        "evidence_confidence": 5,
        "maintenance_cost": 1,
        "redundancy_penalty": 0
      },
      "total_score": 79,
      "value_band": "regression_keep",
      "guardrails": [],
      "reason_codes": [
        "HIGH_BUSINESS_IMPACT",
        "UNIQUE_P1_RISK_COVERAGE"
      ],
      "recommendation": "retain"
    }
  ]
}
